{
  "contract_version": 1,
  "kind": "ASSERTION",
  "status": "INFERRED",
  "validity": "VALID",
  "subject": "endpoint:POST /api/v1/orgs/{orgId}/spaces/{spaceId}/clients",
  "relation": "PROTECTED_BY",
  "object": "symbol:java:com.example.PolicyBasedAuthorizationManager",
  "qualifiers": {},
  "snapshot": {
    "repository": "taxo",
    "commit": "aaaaaaaaaaaaaaaaaaaaaaaaaaaaaaaaaaaaaaaa",
    "mode": "COMMIT"
  },
  "produced_by": {
    "producer_type": "PROJECTION",
    "producer_id": "projection-pr",
    "producer_version": "1.0.0",
    "execution_id": "fixture"
  },
  "derivation": {
    "premises": [
      "fixture-f1",
      "fixture-f2"
    ],
    "rule": "spring-security.route-authorization-applies",
    "counter_examples_checked": [],
    "known_gaps": []
  }
}
