{
  "contract_version": 1,
  "kind": "ASSERTION",
  "status": "INFERRED",
  "validity": "STALE",
  "subject": "endpoint:POST /api/v1/orgs/{orgId}/spaces/{spaceId}/clients",
  "relation": "MATCHED_BY",
  "object": "route-pattern:/api/v1/**",
  "qualifiers": {},
  "snapshot": {
    "repository": "taxo",
    "commit": "80eb595f6d03eea67eb86eae4c7640f94bd3f94c",
    "mode": "COMMIT"
  },
  "produced_by": {
    "producer_type": "EVALUATOR",
    "producer_id": "inventory",
    "producer_version": "1.0.0",
    "execution_id": "fixture",
    "catalog_id": "inventory-rules",
    "catalog_version": "1"
  },
  "derivation": {
    "premises": [
      "fixture-f1",
      "fixture-f2"
    ],
    "rule": "spring-security.first-matching-pattern",
    "counter_examples_checked": [],
    "known_gaps": []
  }
}
