{
  "contract_version": 1,
  "kind": "COVERAGE",
  "status": "OBSERVED",
  "validity": "VALID",
  "snapshot": {
    "repository": "taxo",
    "commit": "aaaaaaaaaaaaaaaaaaaaaaaaaaaaaaaaaaaaaaaa",
    "mode": "COMMIT"
  },
  "produced_by": {
    "producer_type": "EVALUATOR",
    "producer_id": "inventory",
    "producer_version": "1.0.0",
    "execution_id": "fixture",
    "catalog_id": "inventory-rules",
    "catalog_version": "1"
  },
  "scope": {
    "include": [
      "repository:taxo"
    ]
  },
  "subject": "symbol:java:com.example.PolicyEvaluator",
  "coverage_type": "NOT_INTERPRETED",
  "evidence": [
    {
      "repository": "taxo",
      "commit": "aaaaaaaaaaaaaaaaaaaaaaaaaaaaaaaaaaaaaaaa",
      "path": "requirements.txt",
      "method": "inventory.requirements",
      "content_hash": "sha256:aaaaaaaaaaaaaaaaaaaaaaaaaaaaaaaaaaaaaaaaaaaaaaaaaaaaaaaaaaaaaaaa"
    }
  ]
}
