{
  "contract_version": 1,
  "kind": "ABSENCE",
  "status": "INFERRED",
  "validity": "VALID",
  "snapshot": {
    "repository": "taxo",
    "commit": "aaaaaaaaaaaaaaaaaaaaaaaaaaaaaaaaaaaaaaaa",
    "mode": "COMMIT"
  },
  "produced_by": {
    "producer_type": "EVALUATOR",
    "producer_id": "inventory",
    "producer_version": "1.0.0",
    "execution_id": "fixture",
    "catalog_id": "inventory-rules",
    "catalog_version": "1"
  },
  "pattern": {
    "type": "literal",
    "value": "P_SPACE_USER_CREATE"
  },
  "scope": {
    "include": [
      "repository:taxo"
    ]
  },
  "method": "java.string-literal-search"
}
