{
  "contract_version": 1,
  "kind": "ASSERTION",
  "status": "OBSERVED",
  "validity": "VALID",
  "subject": "repository:taxo",
  "relation": "USES_TECHNOLOGY",
  "object": "technology:FastAPI",
  "qualifiers": {},
  "snapshot": {
    "repository": "taxo",
    "commit": "aaaaaaaaaaaaaaaaaaaaaaaaaaaaaaaaaaaaaaaa",
    "mode": "COMMIT"
  },
  "produced_by": {
    "producer_type": "EVALUATOR",
    "producer_id": "inventory",
    "producer_version": "1.0.0",
    "execution_id": "fixture",
    "catalog_id": "inventory-rules",
    "catalog_version": "1"
  }
}
