{
  "contract_version": 1,
  "kind": "ASSERTION",
  "status": "HUMAN_VALIDATED",
  "validity": "VALID",
  "subject": "endpoint:POST /api/v1/orgs/{orgId}/spaces/{spaceId}/clients",
  "relation": "PROTECTED_BY",
  "object": "policy-rule:POL_OAUTH_CLIENT_ADMIN_REQUIRED",
  "qualifiers": {},
  "snapshot": {
    "repository": "taxo",
    "commit": "80eb595f6d03eea67eb86eae4c7640f94bd3f94c",
    "mode": "COMMIT"
  },
  "produced_by": {
    "producer_type": "HUMAN",
    "producer_id": "fixture-reviewer"
  }
}
