{
  "contract_version": 1,
  "kind": "ASSERTION",
  "status": "OBSERVED",
  "validity": "VALID",
  "subject": "repository:taxo",
  "relation": "HAS_COMMIT",
  "object": "commit:2fd4e1c67a2d28fced849ee1bb76e7391b93eb12",
  "qualifiers": {
    "authored_at": "2026-09-24T17:07:44+02:00",
    "committed_at": "2026-09-24T17:07:44+02:00",
    "subject": "feat(history): relier le diff à l'impact"
  },
  "snapshot": {
    "repository": "taxo",
    "commit": "aaaaaaaaaaaaaaaaaaaaaaaaaaaaaaaaaaaaaaaa",
    "mode": "COMMIT"
  },
  "evidence": [
    {
      "repository": "taxo",
      "commit": "aaaaaaaaaaaaaaaaaaaaaaaaaaaaaaaaaaaaaaaa",
      "method": "git.log",
      "object": "commit:2fd4e1c67a2d28fced849ee1bb76e7391b93eb12"
    }
  ],
  "produced_by": {
    "producer_type": "EVALUATOR",
    "producer_id": "taxo.git",
    "producer_version": "0.1.0",
    "execution_id": "fixture",
    "catalog_id": "git",
    "catalog_version": "1"
  }
}
